<?xml version="1.0" encoding="utf-8"?>
<TranslationDetails xmlns:xsi="http://www.w3.org/2001/XMLSchema-instance" xsi:noNamespaceSchemaLocation="https://raw.githubusercontent.com/Inadequado4192/UkrainianPlease/master/Translations/Scheme.xsd">
    <originalMod>
        <name>Achtung!</name>
        <id>730936602</id>
        <packageId>brrainz.achtung</packageId>
    </originalMod>
    <authors>
        <li>
            <nickname>AntiJaoi</nickname>
            <steamId>76561198066973088</steamId>
        </li>
    </authors>
    <sourceTranslationId>2942230958</sourceTranslationId>
    <lastUpdate>2023-03-12T14:38:15.000Z</lastUpdate>
</TranslationDetails>