<?xml version="1.0" encoding="utf-8"?>
<TranslationDetails xmlns:xsi="http://www.w3.org/2001/XMLSchema-instance" xsi:noNamespaceSchemaLocation="../../Scheme.xsd">
    <originalMod>
        <name>Vanilla Plants Expanded - Succulents</name>
        <id>2198652536</id>
        <packageId>vanillaexpanded.vplantsesucculents</packageId>
    </originalMod>
    <authors>
        <li>
            <nickname>Arlechin</nickname>
            <steamId>76561198162359187</steamId>
        </li>
    </authors>
    <sourceTranslationId>3207802982</sourceTranslationId>
    <lastUpdate>2024-03-31T13:27:53.000Z</lastUpdate>
</TranslationDetails>