<?xml version="1.0" encoding="utf-8"?>
<TranslationDetails xmlns:xsi="http://www.w3.org/2001/XMLSchema-instance" xsi:noNamespaceSchemaLocation="../../Scheme.xsd">
    <originalMod>
        <name>Ancient mining industry</name>
        <id>3141472661</id>
        <packageId>xmb.ancientminingindustry.mo</packageId>
    </originalMod>
    <authors>
        <li>
            <nickname>tyulen</nickname>
            <steamId>76561198374567982</steamId>
        </li>
    </authors>
    <sourceTranslationId>3145590348</sourceTranslationId>
    <lastUpdate>2024-04-12T09:07:03.000Z</lastUpdate>
</TranslationDetails>