<?xml version="1.0" encoding="utf-8"?>
<TranslationDetails xmlns:xsi="http://www.w3.org/2001/XMLSchema-instance" xsi:noNamespaceSchemaLocation="../../Scheme.xsd">
    <originalMod>
        <name>Vanilla Storytellers Expanded - Neron Neolithic</name>
        <id>2455898908</id>
        <packageId>vse.neronneolithic</packageId>
    </originalMod>
    <authors>
        <li>
            <nickname>Arlechin</nickname>
            <steamId>76561198162359187</steamId>
        </li>
    </authors>
    <sourceTranslationId>3180536518</sourceTranslationId>
    <lastUpdate>2024-03-12T14:55:35.000Z</lastUpdate>
</TranslationDetails>