<?xml version="1.0" encoding="utf-8"?>
<TranslationDetails xmlns:xsi="http://www.w3.org/2001/XMLSchema-instance" xsi:noNamespaceSchemaLocation="https://raw.githubusercontent.com/Inadequado4192/UkrainianPlease/master/Translations/Scheme.xsd">
    <originalMod>
        <name>More Faction Interaction</name>
        <id>2379076640</id>
        <packageId>mlie.morefactioninteraction</packageId>
    </originalMod>
    <authors>
        <li>
            <nickname>AntiJaoi</nickname>
            <steamId>76561198066973088</steamId>
        </li>
    </authors>
    <sourceTranslationId>2944975214</sourceTranslationId>
    <lastUpdate>2023-04-02T08:08:50.000Z</lastUpdate>
</TranslationDetails>